nom,commune,code_postal,gestionnaire,adresse_l1,telephone,email,site_web,sous_categories,habitat_type,eligibilite_avp,presentation,departement,source,date_extraction,public_cible
Résidence autonomie La Colline,Bouilly,10320,ASIMAT,4 rue de l'Herminette,03 25 28 30 47,lacolline@asimat.fr,https://www.asimat.fr/ehpad-et-residence-autonomie-la-colline/,Résidence autonomie,residence,a_verifier,"Résidence autonomie située à Bouilly, proposant un logement adapté aux seniors en perte d'autonomie légère avec services et animation collective.",Aube (10),https://www.pour-les-personnes-agees.gouv.fr/annuaire-ehpad-et-maisons-de-retraite/residence-autonomie/aube-10/bouilly-10320/residence-autonomie-la-colline/100010503,2025-12-19,personnes_agees
"Résidence autonomie des Orchidées Sainte-Savine, AUBE",Sainte Savine,10300,CCAS,1 rue Eugéne Laroche,03 25 79 06 45,laureline.guibert@philogeris.com,https://trajectoire.sante-ra.fr/GrandAge/Pages/Public/AccesEtablissement.aspx?FINESS=100003573,Résidence autonomie,residence,a_verifier,"Résidence autonomie située à Sainte Savine, proposant un logement adapté aux seniors en perte d'autonomie légère avec services et animation collective.",Aube (10),https://www.pour-les-personnes-agees.gouv.fr/annuaire-ehpad-et-maisons-de-retraite/residence-autonomie/aube-10/sainte-savine-10300/residence-autonomie-des-orchidees/100003573,2025-12-19,personnes_agees
"Résidence autonomie Joseph Wagner Brienne-le-Château, AUBE",Brienne Le Chateau,10500,CCAS,1 allée Jean Nicolas Pierret,03 25 92 81 44,residenceauto.jw@orange.fr,https://ville-brienne-le-chateau.fr/cadre-de-vie/seniors/la-residence-autonomie-joseph-wagner/,Résidence autonomie,residence,a_verifier,"Résidence autonomie située à Brienne Le Chateau, proposant un logement adapté aux seniors en perte d'autonomie légère avec services et animation collective.",Aube (10),https://www.pour-les-personnes-agees.gouv.fr/annuaire-ehpad-et-maisons-de-retraite/residence-autonomie/aube-10/brienne-le-chateau-10500/residence-autonomie-joseph-wagner/100003441,2025-12-19,personnes_agees
Résidence autonomie Les Chèvrefeuilles,Troyes,10000,Centre municipal d'action sociale,37 rue Charles Dutreix,03 25 49 51 30,admi.cmas@ville-troyes.fr,https://www.ville-troyes.fr/au-quotidien/bien-vieillir/se-loger/,Résidence autonomie,residence,a_verifier,"Résidence autonomie située à Troyes, proposant un logement adapté aux seniors en perte d'autonomie légère avec services et animation collective.",Aube (10),https://www.pour-les-personnes-agees.gouv.fr/annuaire-ehpad-et-maisons-de-retraite/residence-autonomie/aube-10/troyes-10000/residence-autonomie-les-chevrefeuilles/100000470,2025-12-19,personnes_agees
"Résidence autonomie Les Érables Les Noës-près-Troyes, AUBE",Les Noes Pres Troyes,10420,Centre municipal d'action sociale,33 rue Millard,03 25 74 80 73,rpa.leserables@orange.fr,https://www.ville-troyes.fr/au-quotidien/bien-vieillir/se-loger/,Résidence autonomie,residence,a_verifier,"Résidence autonomie située à Les Noes Pres Troyes, proposant un logement adapté aux seniors en perte d'autonomie légère avec services et animation collective.",Aube (10),https://www.pour-les-personnes-agees.gouv.fr/annuaire-ehpad-et-maisons-de-retraite/residence-autonomie/aube-10/les-noes-pres-troyes-10420/residence-autonomie-les-erables/100002310,2025-12-19,personnes_agees
"Résidence autonomie Les Mésanges Saint-Parres-lès-Vaudes, AUBE",Saint Parres Les Vaudes,10260,Syndicat I,11 rue des Pommiers,03 25 40 91 55,direction.mesanges@orange.fr,https://trajectoire.sante-ra.fr/GrandAge/Pages/Public/AccesEtablissement.aspx?FINESS=100003581,Résidence autonomie,residence,a_verifier,"Résidence autonomie située à Saint Parres Les Vaudes, proposant un logement adapté aux seniors en perte d'autonomie légère avec services et animation collective.",Aube (10),https://www.pour-les-personnes-agees.gouv.fr/annuaire-ehpad-et-maisons-de-retraite/residence-autonomie/aube-10/saint-parres-les-vaudes-10260/residence-autonomie-les-mesanges/100003581,2025-12-19,personnes_agees
Résidence autonomie Les Ormes,Troyes,10000,Centre municipal d'action sociale,2 rue Andre Mutter,03 25 80 89 08,rpa.lesormes@orange.fr,https://www.ville-troyes.fr/au-quotidien/bien-vieillir/se-loger/,Résidence autonomie,residence,a_verifier,"Résidence autonomie située à Troyes, proposant un logement adapté aux seniors en perte d'autonomie légère avec services et animation collective.",Aube (10),https://www.pour-les-personnes-agees.gouv.fr/annuaire-ehpad-et-maisons-de-retraite/residence-autonomie/aube-10/troyes-10000/residence-autonomie-les-ormes/100002328,2025-12-19,personnes_agees
"Résidence autonomie Saint-Roch Nogent-sur-Seine, AUBE",Nogent sur-Seine,10400,CCAS,1 rue du Champ Mouzard,03 25 39 80 59,residence.st.roch@nogentsurseine.fr,https://www.nogentsurseine.fr/famille-solidarites/le-centre-communal-daction-sociale-ccas/la-residence-autonomie-saint-roch,Résidence autonomie,residence,a_verifier,"Résidence autonomie située à Nogent sur-Seine, proposant un logement adapté aux seniors en perte d'autonomie légère avec services et animation collective.",Aube (10),https://www.pour-les-personnes-agees.gouv.fr/annuaire-ehpad-et-maisons-de-retraite/residence-autonomie/aube-10/nogent-sur-seine-10400/residence-autonomie-saint-roch/100002112,2025-12-19,personnes_agees
Résidence Services Carré Madeleine,Troyes,10000,Ovelia,6 Rue du Ravelin,03 53 72 00 13,,https://www.ovelia.fr/residences-seniors/troyes-carre-madeleine,Résidence services seniors,residence,a_verifier,,10,pour-les-personnes-agees.gouv.fr,,personnes_agees
Habitat inclusif de LADAPT Aube,Troyes,10000,LADAPT,32 Rue Beau Tocquat,07 57 40 86 79,troyes@ladapt.net,https://www.ladapt.net/etablissement-service-est-aube,Habitat inclusif,habitat_partage,a_verifier,"**Présentation de l'Habitat inclusif de LADAPT Aube** L'Habitat inclusif de LADAPT Aube est un établissement situé à Troyes (10000), dans le département de l'Aube. Il propose un habitat inclusif pour les personnes en situation de handicap. **Gestionnaire et public accueilli** L'Habitat inclusif de LADAPT Aube est géré par LADAPT, une organisation spécialisée dans l'accompagnement et l'insertion des personnes en situation de handicap. L'établissement accueille des personnes en situation de handicap, proposant un accompagnement individualisé pour leur insertion sociale et professionnelle.",Aube (10),https://maboussoleaidants.fr/mes-solutions/habitat-alternatif-senior-handicap/10/10016263,2025-12-19,personnes_handicapees
Maison partagée Essoyes,Essoyes,10360,Ages & Vie,3A ET 3B IMPASSE ARNAUD BELTRAME,0801 07 08 09,,https://agesetvie.com/maisons-partagees/grand-est/aube-10/essoyes-10360/maisons-partagees-essoyes,Colocation avec services,habitat_partage,non_eligible,"Maison partagée Essoyes La Maison partagée Essoyes est un établissement de colocation avec services situé à Essoyes, dans le département de l'Aube. Cette maison partagée propose une solution de vie en communauté pour les personnes âgées qui cherchent une alternative au domicile individuel ou à la maison de retraite. Géré par l'établissement Maison partagée Essoyes, cet établissement accueille les personnes âgées qui souhaitent continuer à mener une vie autonome et indépendante.",Aube (10),https://agesetvie.com/maisons-partagees/grand-est/aube-10,2025-12-19,personnes_agees
Maison partagée Plancy-l'Abbaye,Plancy-l'Abbaye,10380,Ages & Vie,2 PLACE VICTOIRE,0801 07 08 09,,https://agesetvie.com/maisons-partagees/grand-est/aube-10/plancy-l-abbaye-10380/maisons-partagees-plancy-l-abbaye,Colocation avec services,habitat_partage,non_eligible,"Maison partagée Plancy-l'Abbaye La Maison partagée Plancy-l'Abbaye est un établissement de colocation avec services situé à Plancy-l'Abbaye, dans le département de l'Aube. Cette maison partagée est gérée par l'établissement Ages & Vie. Cette maison partagée est conçue pour accueillir les seniors en perte d'autonomie, leur permettant de continuer à mener une vie autonome et indépendante. L'établissement propose une présence sécurisante durant la journée, respect des habitudes de vie et un accompagnement pour les gestes du quotidien devenus difficiles.",Aube (10),https://agesetvie.com/maisons-partagees/grand-est/aube-10,2025-12-19,personnes_agees
Maison seniors de Troyes - CetteFamille,Troyes,10000,CetteFamille,"9 Rue Henri Lemasson, 10000 Troyes",+33 3 74 47 26 66,,https://www.cettefamille.com/habitats-partages/france/grand-est/troyes/maison-pour-seniors-de-troyes/,Maison d'accueil familial,habitat_partage,non_eligible,"Maison seniors de Troyes - CetteFamille Située au cœur de la ville de Troyes, dans le département de l'Aube, la Maison seniors de Troyes - CetteFamille est une maison d'accueil familial conçue pour accueillir des personnes âgées en perte d'autonomie. Cette structure est idéalement située pour offrir un environnement convivial et sécurisé. Géré par l'établissement Maison seniors de Troyes - CetteFamille, cet établissement accueille des personnes âgées qui recherchent du lien social et l'accompagnement d'un professionnel au quotidien.",Aube (10),https://www.cettefamille.com/habitats-partages/france/grand-est/troyes/maison-pour-seniors-de-troyes/,2025-12-19,personnes_agees
Colocation seniors,Troyes,10000,,,,,https://www.cettefamille.com/habitats-partages/france/grand-est/troyes/maison-pour-seniors-de-troyes/,Colocation avec services,habitat_partage,non_eligible,"**Présentation de l'établissement Colocation seniors** L'établissement Colocation seniors est une maison partagée située au cœur de la ville de Troyes, dans le département de l'Aube. Cette structure est conçue pour accueillir des personnes âgées en perte d'autonomie qui recherchent du lien social et l'accompagnement d'un professionnel au quotidien. L'établissement Colocation seniors est géré par l'établissement lui-même. Il accueille des personnes âgées en perte d'autonomie qui bénéficient d'un accompagnement quotidien et de services adaptés à leurs besoins.",Aube (10),https://www.lest-eclair.fr/id660005/article/2024-11-11/troyes-la-colocation-pour-vos-parents-ou-vos-grands-parents-ca-vous-dit,2025-12-19,personnes_agees
Maison Ages & Vie de Charmont sous Barbuise,Charmont sous Barbuise,10150,Ages & Vie,1 ET 1 BIS RUE BEAUREGARD,0801 07 08 09,,https://agesetvie.com/maisons-partagees/grand-est/aube-10/charmont-sous-barbuise-10150/maisons-partagees-charmont-sous-barbuise,Colocation avec services,habitat_partage,non_eligible,"Maison Ages & Vie de Charmont sous Barbuise Située à Charmont sous Barbuise, dans le département de l'Aube, la Maison Ages & Vie de Charmont sous Barbuise est une colocation avec services spécialement conçue pour les seniors en perte d'autonomie. Cette maison partagée est gérée par l'établissement Maison Ages & Vie de Charmont sous Barbuise. La Maison Ages & Vie de Charmont sous Barbuise accueille les personnes âgées qui cherchent une solution de proximité entre le domicile individuel et la maison de retraite.",Aube (10),https://www.papyhappy.fr/etablissement-habitat-partage/groupe/ages-vie/aube-10,2025-12-19,personnes_agees
